{
  "schema_version": "1",
  "receipt_path": "artifacts/deploy/deployment_verification_receipt.json",
  "bundle_path": "artifacts/deploy/deployment_verification_evidence_bundle.json",
  "desired": {
    "receipt_path": "artifacts/deploy/deployment_verification_receipt.json",
    "artifact_version": "0.2.0",
    "profile_name": "staging-a",
    "verification_status": "passed",
    "evidence_count": 2,
    "evidence_sources": [
      {
        "artifact_path": "artifacts/eval/mnist_eval_summary.json",
        "event_name": "eval_done",
        "observed_at_unix_ms": 1735689601000
      },
      {
        "artifact_path": "artifacts/deploy/candidate_upload_request.json",
        "event_name": "artifact_upload_request_written",
        "observed_at_unix_ms": 1735689602000
      }
    ]
  },
  "current": {
    "receipt_path": "artifacts/deploy/deployment_verification_receipt.json",
    "artifact_version": "0.2.0",
    "profile_name": "staging-a",
    "verification_status": "passed",
    "evidence_count": 2,
    "evidence_sources": [
      {
        "artifact_path": "artifacts/eval/mnist_eval_summary.json",
        "event_name": "eval_done",
        "observed_at_unix_ms": 1735689601000
      },
      {
        "artifact_path": "artifacts/deploy/candidate_upload_request.json",
        "event_name": "artifact_upload_request_written",
        "observed_at_unix_ms": 1735689602000
      }
    ]
  },
  "reconciliation_status": "aligned"
}
